[
  {
    "id": "shona-pilot-lesson-greetings",
    "revision": 1,
    "title": "Greetings and Courtesies",
    "objective": "Follow Tendai's day of visits to neighbor Rudo -- a morning arrival, being welcomed in and giving thanks, an afternoon return, and an evening farewell -- through six real Shona greeting/courtesy phrases (each used exactly once, in the time-of-day/register it actually fits), then choose a contextually appropriate reply.",
    "format": "guided_conversation",
    "prerequisiteLessonIds": [],
    "linkedPhraseIds": [
      "shona-pilot-hello-sg",
      "shona-pilot-hello-pl",
      "shona-pilot-welcome",
      "shona-pilot-good-morning",
      "shona-pilot-good-afternoon",
      "shona-pilot-good-evening",
      "shona-pilot-thanks-sg",
      "shona-pilot-thanks-pl"
    ],
    "activities": [
      {
        "id": "scene-setup",
        "kind": "reflection",
        "prompt": "Setting: Tendai visits their neighbor Rudo three times in one day -- once in the morning, once in the afternoon, and once at night to say goodbye. Read the six exchanges below in order, then try the reply question at the end."
      },
      {
        "id": "t1",
        "kind": "dialogue_turn",
        "speaker": "Tendai",
        "text": "Mangwanani",
        "translation": "Good morning",
        "audioAssetId": null,
        "linkedPhraseId": "shona-pilot-good-morning"
      },
      {
        "id": "t2",
        "kind": "dialogue_turn",
        "speaker": "Rudo",
        "text": "Mauya",
        "translation": "Welcome",
        "audioAssetId": null,
        "linkedPhraseId": "shona-pilot-welcome"
      },
      {
        "id": "t3",
        "kind": "dialogue_turn",
        "speaker": "Tendai",
        "text": "Waita zvako",
        "translation": "Thank you (one person)",
        "audioAssetId": null,
        "linkedPhraseId": "shona-pilot-thanks-sg"
      },
      {
        "id": "t4",
        "kind": "dialogue_turn",
        "speaker": "Tendai",
        "text": "Masikati",
        "translation": "Good afternoon",
        "audioAssetId": null,
        "linkedPhraseId": "shona-pilot-good-afternoon"
      },
      {
        "id": "t5",
        "kind": "dialogue_turn",
        "speaker": "Rudo",
        "text": "Mhoro",
        "translation": "Hello (one person)",
        "audioAssetId": null,
        "linkedPhraseId": "shona-pilot-hello-sg"
      },
      {
        "id": "t6",
        "kind": "dialogue_turn",
        "speaker": "Rudo",
        "text": "Manheru",
        "translation": "Good evening",
        "audioAssetId": null,
        "linkedPhraseId": "shona-pilot-good-evening"
      },
      {
        "id": "transfer-1",
        "kind": "choice",
        "task": {
          "id": "transfer-1-task",
          "prompt": "As you leave for the night, Rudo says \"Manheru\" to you. What is the appropriate one-person reply?",
          "choices": [
            {
              "id": "c1",
              "text": "Manheru (Good evening)"
            },
            {
              "id": "c2",
              "text": "Mangwanani (Good morning)"
            },
            {
              "id": "c3",
              "text": "Mhoroi (Hello, to a group)"
            },
            {
              "id": "c4",
              "text": "Masikati (Good afternoon)"
            }
          ],
          "acceptedChoiceIds": [
            "c1"
          ],
          "feedbackCorrect": "Correct: mirroring the same evening greeting back is the natural one-to-one reply.",
          "feedbackIncorrect": "Not quite: this reply either names the wrong time of day or is the group form, not a matching one-person evening farewell."
        }
      }
    ],
    "requiredActivityIds": [
      "t1",
      "t2",
      "t3",
      "t4",
      "t5",
      "t6",
      "transfer-1"
    ]
  },
  {
    "id": "shona-pilot-lesson-listening",
    "revision": 2,
    "title": "Listen: greetings through the day",
    "objective": "Hear the greetings and courtesies from the first lesson spoken by a real speaker, then pick out the word for Welcome.",
    "format": "listening",
    "prerequisiteLessonIds": [
      "shona-pilot-lesson-greetings"
    ],
    "linkedPhraseIds": [
      "shona-pilot-hello-sg",
      "shona-pilot-hello-pl",
      "shona-pilot-welcome",
      "shona-pilot-good-morning",
      "shona-pilot-good-afternoon",
      "shona-pilot-good-evening",
      "shona-pilot-thanks-sg",
      "shona-pilot-thanks-pl"
    ],
    "activities": [
      {
        "id": "listen-1",
        "kind": "listening",
        "audioAssetId": null,
        "unavailableReason": "No native-speaker or otherwise authentic recording of this phrase set exists yet. Reusing unrelated benchmark speech or a synthesized voice would misrepresent the audio as authentic, so listening stays explicitly unavailable until a real, consenting recording is obtained.",
        "transcript": "Mhoro / Mhoroi / Mauya / Mangwanani / Masikati / Manheru / Waita zvako / Maita zvenyu",
        "translation": "Hello / Hello (group) / Welcome / Good morning / Good afternoon / Good evening / Thank you / Thank you (group)",
        "comprehension": {
          "kind": "choice_task",
          "task": {
            "id": "listen-1-comprehension",
            "prompt": "Once a real recording exists: which transcript word means \"Welcome\"?",
            "choices": [
              {
                "id": "w1",
                "text": "Mhoro"
              },
              {
                "id": "w2",
                "text": "Mauya"
              },
              {
                "id": "w3",
                "text": "Manheru"
              }
            ],
            "acceptedChoiceIds": [
              "w2"
            ],
            "feedbackCorrect": "Correct: Mauya means Welcome.",
            "feedbackIncorrect": "Check the transcript/translation pairing above and try again."
          }
        }
      }
    ],
    "requiredActivityIds": [
      "listen-1"
    ]
  },
  {
    "id": "shona-pilot-lesson-pattern",
    "revision": 2,
    "title": "Address Pattern Workshop",
    "objective": "Notice how two of these courtesy phrases change when addressing more than one person, then construct both forms.",
    "format": "pattern_workshop",
    "prerequisiteLessonIds": [
      "shona-pilot-lesson-greetings"
    ],
    "linkedPhraseIds": [
      "shona-pilot-hello-sg",
      "shona-pilot-hello-pl",
      "shona-pilot-thanks-sg",
      "shona-pilot-thanks-pl"
    ],
    "activities": [
      {
        "id": "explain-1",
        "kind": "pattern_explanation",
        "explanation": "Two of this pack's checked phrase pairs change when you address more than one person: Mhoro becomes Mhoroi, and Waita zvako becomes Maita zvenyu. This workshop only demonstrates the pattern for these two already-checked pairs; it is not a general grammar rule for other Shona words, which would need separate native-speaker confirmation.",
        "examples": [
          "Mhoro (Hello, one person) → Mhoroi (Hello, more than one person)",
          "Waita zvako (Thank you, one person) → Maita zvenyu (Thank you, more than one person)"
        ]
      },
      {
        "id": "construct-guided-1",
        "kind": "ordered_tokens",
        "task": {
          "id": "construct-guided-1-task",
          "prompt": "Build the one-person greeting.",
          "tokens": [
            {
              "occurrenceId": "tok1",
              "text": "Mhoro"
            }
          ],
          "acceptedSequences": [
            [
              "tok1"
            ]
          ],
          "feedbackCorrect": "Right: that is the one-person form.",
          "feedbackIncorrect": "This phrase has only one token to place; check the word itself against the earlier lesson."
        },
        "assistanceHint": "This activity is supported: the single token is already the whole answer."
      },
      {
        "id": "construct-changed-context-1",
        "kind": "ordered_tokens",
        "task": {
          "id": "construct-changed-context-1-task",
          "prompt": "Now thank a group of people (not just one person) using the pattern above.",
          "tokens": [
            {
              "occurrenceId": "tok1",
              "text": "Maita"
            },
            {
              "occurrenceId": "tok2",
              "text": "zvenyu"
            }
          ],
          "acceptedSequences": [
            [
              "tok1",
              "tok2"
            ]
          ],
          "feedbackCorrect": "Right: Maita zvenyu is the group form of Waita zvako, following the same pattern as Mhoro/Mhoroi.",
          "feedbackIncorrect": "Reorder the two words so the group-thanks phrase reads correctly; remember this is the changed-context (plural) counterpart to Waita zvako."
        }
      }
    ],
    "requiredActivityIds": [
      "explain-1",
      "construct-guided-1",
      "construct-changed-context-1"
    ]
  }
]
